{
"name": "gidgethub",
"title": "gidgethub",
"description": "An async GitHub API library for Python.",
"logo_url": null,
"repo_url": "https://github.com/gidgethub/gidgethub",
"bug_reports_url": "https://github.com/gidgethub/gidgethub/issues",
"pypi_url": "https://pypi.org/project/gidgethub/",
"docs_url": "https://gidgethub.readthedocs.io",
"last_updated": "2025-06-03",
"maintainers": [
    {
    "name": "Mariatta Wijaya",
    "social_media": [{
        "x": "mariatta",
        "mastodon": "@mariatta@fosstodon.org",
        "github": "mariatta",
        "website": "https://mariatta.ca",
        "linkedin": "mariatta"
    }]
    },
    {
        "name": "Brett Cannon",
        "pyladies": false
    }
]
}