{
  "name": "singularity-hpc",
  "title": "singularity-hpc",
  "description": "Local filesystem registry for containers (intended for HPC) using Lmod or Environment Modules.",
  "logo_url": "https://raw.githubusercontent.com/singularityhub/singularity-hpc/refs/heads/main/docs/assets/img/shpc.svg",
  "repo_url": "https://github.com/singularityhub/singularity-hpc",
  "bug_reports_url": "https://github.com/singularityhub/singularity-hpc/issues",
  "pypi_url": "https://pypi.org/project/singularity-hpc/",
  "docs_url": null,
  "last_updated": "2025-04-12",
  "maintainers": [
    {
      "name": "Vanessa Sochat",
      "social_media": [{
          "x": "vsoch",
          "mastodon": "@vsoch@mastodon.social",
          "bluesky": "vsoch.bsky.social",
          "github": "vsoch",
          "website": "https://vsoch.github.io/"
      }]
    }
  ]
}