{
  "name": "nox",
  "title": "nox",
  "description": "Flexible test automation for Python.",
  "logo_url": "https://raw.githubusercontent.com/wntrblm/nox/refs/heads/main/docs/_static/alice.png",
  "repo_url": "https://github.com/wntrblm/nox",
  "bug_reports_url": "https://github.com/wntrblm/nox/issues",
  "pypi_url": "https://pypi.org/project/nox/",
  "docs_url": "https://nox.thea.codes",
  "last_updated": "2026-04-10",
  "maintainers": [
    {
      "name": "Thea Flowers",
      "social_media": [{
        "github": "theacodes",
        "x": "theacodes",
        "website": "https://thea.codes/",
        "mastodon": "stargirl@hachyderm.io",
        "bluesky": "theacodes.bsky.social"
      }]
    },
    {
      "name": "Danny Hermes",
      "pyladies": false,
      "social_media": [{
        "github": "bossylobster"
      }]
    },
    {
      "name": "Chris Wilcox",
      "pyladies": false,
      "social_media": [{
        "github": "crwilcox"
      }]
    },
    {
      "name": "Henry Schreiner",
      "pyladies": false,
      "social_media": [{
        "github": "henryiii"
      }]
    },
    {
      "name": "Luke Sneeringer",
      "pyladies": false,
      "social_media": [{
        "github": "lukesneeringer"
      }]
    },
    {
      "name": "Diego Ramirez",
      "pyladies": false,
      "social_media": [{
        "github": "stsewd"
      }]
    }
  ]
}
