{
  "name": "flask-talisman",
  "title": "flask-talisman",
  "description": "A small Flask extension that handles HTTP security headers for you.",
  "logo_url": null,
  "repo_url": "https://github.com/wntrblm/flask-talisman",
  "bug_reports_url": "https://github.com/wntrblm/flask-talisman/issues",
  "pypi_url": "https://pypi.org/project/flask-talisman/",
  "docs_url": null,
  "last_updated": "2023-08-03",
  "maintainers": [
    {
      "name": "Thea Flowers",
      "social_media": [{
        "github": "theacodes",
        "x": "theacodes",
        "website": "https://thea.codes/",
        "mastodon": "stargirl@hachyderm.io",
        "bluesky": "theacodes.bsky.social"
      }]
    },
    {
      "name": "jonakemon",
      "pyladies": false,
      "social_media": [{
        "github": "jonakemon"
      }]
    },
    {
      "name": "Jannis Leidel",
      "pyladies": false,
      "social_media": [{
        "github": "jezdez"
      }]
    }
  ]
}
