{
    "name": "roctet",
    "title": "roctet",
    "description": "Generate diverse score-target datasets with the same AUROC value, ala Anscombe's Quartet",
    "logo_url": null,
    "repo_url": "https://github.com/emilyriederer/roctet",
    "bug_reports_url": "https://github.com/emilyriederer/roctet/issues",
    "pypi_url": "https://pypi.org/project/roctet/",
    "docs_url": null,
    "last_updated": "2026-03-22",
    "maintainers": [
        {
            "name": "Emily Riederer",
            "social_media": [
                {
                    "x": "emilyriederer",
                    "mastodon": "@emilyriederer@mastodon.social",
                    "github": "emilyriederer",
                    "website": "emilyriederer.com",
                    "linkedin": "emilyriederer/",
                    "facebook": "emilyriederer",
                    "orcid": "0000-0002-1788-7934",
                    "bluesky": "@emilyriederer.bsky.social"
                }
            ]
        }
    ]
}