{
  "name": "pokemon",
  "title": "pokemon",
  "description": "ascii database of pokemon in Python!",
  "logo_url": "https://raw.githubusercontent.com/vsoch/pokemon/master/img/avatar.png",
  "repo_url": "https://github.com/vsoch/pokemon",
  "bug_reports_url": "https://github.com/vsoch/pokemon/issues",
  "pypi_url": "https://pypi.org/project/pokemon/",
  "docs_url": null,
  "last_updated": "2023-01-17",
  "maintainers": [
    {
      "name": "Vanessa Sochat",
      "social_media": [
        {
          "x": "vsoch",
          "mastodon": "@vsoch@mastodon.social",
          "bluesky": "vsoch.bsky.social",
          "github": "vsoch",
          "website": "https://vsoch.github.io/"
        }
      ]
    }
  ]
}